id,course_code,campus,year,name,description,credits,is_honours,restrictions,equivalent_string,co-req_string,pre-req_string,courses_in_equivalent_string,courses_in_co-req_string,courses_in_pre-req_string,winter_term_1,winter_term_2,summer_term_1,summer_term_2,duration_terms//,source
c-621,ENGR 380,UBCO,2023,ENGR 380 Design of Machine Elements,"Product design methodology; static and fatigue failure theory; design/selection of components including shafts, springs, bearings, gears, brakes, and clutches; design of bolted joints, power screws, and welds; design evaluation and optimization.",3,FALSE,,,,APSC 260.,,,APSC 260,FALSE,TRUE,FALSE,FALSE,1,https://okanagan.calendar.ubc.ca/course-descriptions/subject/engro
c-622,ENGR 381,UBCO,2023,ENGR 381 Kinematics and Dynamics of Machinery,"The design, analysis, and synthesis of mechanisms, linkages, cams, and gear trains; dynamic force analysis; balancing of rotating and reciprocating masses.",3,FALSE,,,,APSC 181.,,,APSC 181,TRUE,FALSE,FALSE,FALSE,1,https://okanagan.calendar.ubc.ca/course-descriptions/subject/engro
c-623,ENGR 385,UBCO,2023,ENGR 385 Heat Transfer Applications,"Steady and transient conduction heat transfer, radiation heat transfer, convection heat transfer, introduction to heat exchanger.",3,FALSE,,,,"All of APSC 248, APSC 252.",,,"APSC 248,APSC 252",FALSE,TRUE,FALSE,FALSE,1,https://okanagan.calendar.ubc.ca/course-descriptions/subject/engro
c-624,ENGR 387,UBCO,2023,ENGR 387 Vibration of Mechanical Systems,"Vibration of mechanical systems. Single and multiple degree of freedom systems. Undamped, damped vibrations. Forced vibrations and resonance. Modal analysis, modelling vibrating systems. Spectral analysis. Measurement and control of vibrating mechanical systems.",3,FALSE,,,,APSC 246.,,,APSC 246,TRUE,FALSE,FALSE,FALSE,1,https://okanagan.calendar.ubc.ca/course-descriptions/subject/engro
c-625,ENGR 401,UBCO,2023,ENGR 401 Bioinstrumentation,"Bioinstruments used for tracking vitals, diagnosis, and treatment of disease in the vascular, muscular, nervous, and respiratory systems. Introduction to the fundamentals of each body system, electrical safety, signal acquisition, biosensors, transducers, amplifiers, and analysis of human physiological measurements. Hands on experience with sensors, biomedical devices, and design through labs.",3,FALSE,,,,APSC 254.,,,APSC 254,TRUE,FALSE,FALSE,FALSE,1,https://okanagan.calendar.ubc.ca/course-descriptions/subject/engro
c-626,ENGR 402,UBCO,2023,ENGR 402 Biotechnology: Fundamentals and Applications,"Basics of biotechnology, DNA and RNA technologies, nanobiotechnology, medical biotechnology, and ethics in biotechnology.",3,FALSE,,,,(Third-year standing),,,,FALSE,TRUE,FALSE,FALSE,1,https://okanagan.calendar.ubc.ca/course-descriptions/subject/engro
c-627,ENGR 405,UBCO,2024,ENGR 405 Engineering Leadership,"Introduction to Engineering Leadership. Leadership styles. Understanding persuasion and influence. Goal setting and accountability within an engineering team, team building and team dynamics, including issues of equity, diversity and inclusion in teams. Credit will be granted for only one of APSC 505 or ENGR 405.",3,FALSE,,,,(Fourth-year B.A.Sc. standing.),,,,FALSE,FALSE,FALSE,TRUE,1,https://okanagan.calendar.ubc.ca/course-descriptions/subject/engro
c-628,ENGR 406,UBCO,2023,ENGR 406 Microelectromechanical Systems,"Mechanisms, design, fabrication, and testing of microsensors, actuators, and MicroElectroMechanical systems (MEMS). Credit will not be granted for both ENGR 406 and ENGR 506",3,FALSE,,,,(Fourth-year B.A.Sc. standing.),,,,TRUE,FALSE,FALSE,FALSE,1,https://okanagan.calendar.ubc.ca/course-descriptions/subject/engro
c-629,ENGR 407,UBCO,2024,ENGR 407 Inclusive Design,"Design and prototyping of devices from different perspectives of inclusion, with an emphasis on disability, chronic illness, and population diversity; analysis of existing technologies and practices, including built environments, portable devices, user interfaces, sports, and occupational task and process design.",3,FALSE,,,,,,,,FALSE,TRUE,TRUE,FALSE,1,https://okanagan.calendar.ubc.ca/course-descriptions/subject/engro
c-630,ENGR 408,UBCO,2023,ENGR 408 Energy System Transition,"GHG emission reductions, examination of the sources and use of energy, practical potential transition strategies. Participation in a one-day weekend field trip in March is required.",3,FALSE,,,,ENGR 320.,,,ENGR 320,FALSE,TRUE,FALSE,FALSE,1,https://okanagan.calendar.ubc.ca/course-descriptions/subject/engro
c-631,ENGR 409,UBCO,2023,ENGR 409 Construction Digitalization and Informatics,Lean construction; logistics optimization; n-dimensional Building Information Modeling (nD BIM); Internet of Things and Construction 4.0 technologies; new business models; digital fabrication and platform-based construction. Credit will be granted for only one of ENGR 409 or APSC 509.,3,FALSE,This course is restricted to students in one of these programs: BASC-O in year: >=4,,,"One of ENGR 303, MANF 470.",,,"ENGR 303,MANF 470",TRUE,FALSE,FALSE,FALSE,1,https://okanagan.calendar.ubc.ca/course-descriptions/subject/engro
c-632,ENGR 411,UBCO,2023,ENGR 411 Technology Entrepreneurship for Engineers,"Engineering and innovation, business models, customer development, intellectual property, product development, customer validation, hypothesis testing, company positioning. Credit will be granted for only one of ENGR 411 or ENGR 511.",3,FALSE,,,,(Fourth-year B.A.Sc. standing.),,,,FALSE,TRUE,FALSE,FALSE,1,https://okanagan.calendar.ubc.ca/course-descriptions/subject/engro
c-633,ENGR 413,UBCO,2024,ENGR 413 Law and Ethics for Engineers,"Ethical theories and their application. The Canadian legal system. Companies, partnerships, independent contractors. Contract documents, specifications, liability, torts and liens. Intellectual property. Agency; evidence; role of an expert witness. Employment law. Professional Governance Act, Code of Ethics, consultation and engagement with Indigenous communities.",3,FALSE,This course is restricted to students in one of these programs: BASC-O in year: =4,,,(Fourth-year standing.),,,,FALSE,TRUE,TRUE,FALSE,1,https://okanagan.calendar.ubc.ca/course-descriptions/subject/engro
c-634,ENGR 414,UBCO,2023,ENGR 414 Precast Concrete Structures,Means and methods of precast concrete construction; advanced design of precast concrete structures; analysis of experimental data of precast concrete components; innovations in precast concrete construction. Credit will be granted for only one of ENGR 414 or APSC 514.,3,FALSE,,,,ENGR 325 and ENGR 327.,,,"ENGR 325,ENGR 327",FALSE,TRUE,FALSE,FALSE,1,https://okanagan.calendar.ubc.ca/course-descriptions/subject/engro
c-635,ENGR 417,UBCO,2023,ENGR 417 Pipeline Integrity Management,"Pipeline regulation codes, pipeline integrity management, pipeline operations, materials and fabrication, examination techniques, corrosion protection, and geohazards evaluation.",3,FALSE,,,,(Fourth-year B.A.Sc. standing.),,,,FALSE,TRUE,FALSE,FALSE,1,https://okanagan.calendar.ubc.ca/course-descriptions/subject/engro
c-636,ENGR 418,UBCO,2023,ENGR 418 Applied Machine Learning for Engineers,"Fundamentals of machine learning, toolboxes in machine learning, supervised learning, unsupervised learning, applications of machine learning in various engineering disciplines. Credit will be granted for only one of ENGR 418 or ENGR 518.",3,FALSE,,,,(Fourth-year B.A.Sc. standing.),,,,TRUE,FALSE,FALSE,FALSE,1,https://okanagan.calendar.ubc.ca/course-descriptions/subject/engro
c-637,ENGR 424,UBCO,2023,ENGR 424 Smart Cities,"Smart city concept, smart city standardization, smart grid and energy management, Internet of Things and cloud computing for smart city, smart city lighting, intelligent transportation, technology enhanced infrastructure, water solutions, smart buildings and technology, data analytics in smart cities.",3,FALSE,,,,(Fourth-year B.A.Sc. standing.),,,,FALSE,TRUE,FALSE,FALSE,1,https://okanagan.calendar.ubc.ca/course-descriptions/subject/engro
c-638,ENGR 425,UBCO,2023,ENGR 425 Design of Steel and Timber Structures,"Introduction to limit states design of steel and timber structures: material properties, design of tension and compression members, beams, columns, and connections.",3,FALSE,,,,"All of ENGR 325, ENGR 327.",,,"ENGR 325,ENGR 327",FALSE,TRUE,FALSE,FALSE,1,https://okanagan.calendar.ubc.ca/course-descriptions/subject/engro
c-639,ENGR 426,UBCO,2023,ENGR 426 Analysis of Indeterminate Structures,"Analysis of statically indeterminate structures using flexibility and stiffness methods. Linear and non-linear analysis, introduction to finite element method.",3,FALSE,,,,"All of APSC 179, ENGR 327.",,,"APSC 179,ENGR 327",TRUE,FALSE,FALSE,FALSE,1,https://okanagan.calendar.ubc.ca/course-descriptions/subject/engro
c-640,ENGR 427,UBCO,2023,ENGR 427 Reinforced Concrete Design II,"Design of reinforced concrete two-way slabs, slender columns, footings, and walls. Design for torsion.",3,FALSE,,,,"All of ENGR 325, ENGR 327.",,,"ENGR 325,ENGR 327",TRUE,FALSE,FALSE,FALSE,1,https://okanagan.calendar.ubc.ca/course-descriptions/subject/engro
c-641,ENGR 428,UBCO,2023,ENGR 428 Earthquake Engineering,Strong ground motion; single-degree-of-freedom systems; earthquake response of linear and inelastic systems; subspace iteration; multi-degree-of-freedom systems; earthquake response and design; building design consideration.,3,FALSE,,,,ENGR 327.,,,ENGR 327,TRUE,FALSE,FALSE,FALSE,1,https://okanagan.calendar.ubc.ca/course-descriptions/subject/engro
c-642,ENGR 429,UBCO,2023,ENGR 429 Rehabilitation of Concrete Structures,"Concrete damage and deterioration mechanisms, assessment and instrumentation; repair and strengthening materials and techniques; design of structural strengthening systems. Credit will be granted for only one of ENGR 429 or ENGR 529.",3,FALSE,,,,"All of ENGR 325, ENGR 327.",,,"ENGR 325,ENGR 327",FALSE,TRUE,FALSE,FALSE,1,https://okanagan.calendar.ubc.ca/course-descriptions/subject/engro
c-643,ENGR 432,UBCO,2023,ENGR 432 Infrastructure Management II,"Impact of climate change, integrated asset management, resilient infrastructure, condition assessment and performance modeling, in-service monitoring and risk-based evaluation, life cycle cost and benefits analysis, prioritization and optimization, advanced modellling and GIS implementation.",3,FALSE,,,,"All of ENGR 303, ENGR 305, ENGR 330, ENGR 331.",,,"ENGR 303,ENGR 305,ENGR 330,ENGR 331",TRUE,FALSE,FALSE,FALSE,1,https://okanagan.calendar.ubc.ca/course-descriptions/subject/engro
c-644,ENGR 433,UBCO,2023,ENGR 433 Construction Engineering and Management,"Management of the firm: strategic planning, designing, construction, productivity management, and project closure. Project delivery systems: traditional, construction management, and turnkey. Estimating, bidding, and bonding. Project control tools and procedures. Safety and quality control. Project Management. Credit will be granted for only one of ENGR 433 or ENGR 533.",3,FALSE,,,,ENGR 303.,,,ENGR 303,TRUE,FALSE,FALSE,FALSE,1,https://okanagan.calendar.ubc.ca/course-descriptions/subject/engro
c-645,ENGR 436,UBCO,2023,ENGR 436 Transportation Planning,"Processes and techniques to facilitate properly integrated land use and transport systems, including: survey and data techniques; trip generation; trip distribution; modal choice; trip assignment; development traffic impact assessment; sustainable transportation strategies; and vulnerable road users. Credit will be granted for only one of ENGR 436 or ENGR 536.",3,FALSE,,,,ENGR 335.,,,ENGR 335,TRUE,FALSE,FALSE,FALSE,1,https://okanagan.calendar.ubc.ca/course-descriptions/subject/engro
c-646,ENGR 437,UBCO,2024,ENGR 437 Railway Systems Engineering,"Topics on the principles, data, specifications, plans and economics pertaining to the planning, design, construction, and operation of railways tracks, controls, running stock, facilities. Credit will be granted for only one of ENGR 437 or ENGR 537.",3,FALSE,,,,ENGR 335.,,,ENGR 335,FALSE,FALSE,FALSE,TRUE,1,https://okanagan.calendar.ubc.ca/course-descriptions/subject/engro
c-647,ENGR 438,UBCO,2023,ENGR 438 Rock Mechanics and Rock Engineering,"Mechanical properties of intact rock. Rock mass properties and classifications. Structural mapping and stereonets. Rock and rock mass strength criteria. Stresses in rock masses. Rock slope stability analysis. Empirical, analytical, and numerical analysis techniques for underground excavations. Rock support and stabilization. Credit will be granted for only one of ENGR 438 or ENGR 538.",3,FALSE,,,,ENGR 340.,,,ENGR 340,TRUE,FALSE,FALSE,FALSE,1,https://okanagan.calendar.ubc.ca/course-descriptions/subject/engro
c-648,ENGR 440,UBCO,2023,ENGR 440 Foundation Engineering,"Empirical and analytical approaches for foundation engineering. Topics include site investigation, lateral earth pressure, ground improvement, design of shallow and deep foundations, and retaining structures.",3,FALSE,,,ENGR 327.,ENGR 340.,,ENGR 327,ENGR 340,TRUE,FALSE,FALSE,FALSE,1,https://okanagan.calendar.ubc.ca/course-descriptions/subject/engro
c-649,ENGR 441,UBCO,2023,ENGR 441 Advanced Water Treatment Processes,"Theory and design of advanced drinking water treatment processes used for challenging source water conditions including advanced oxidation, membrane filtration, ultraviolet disinfection, and adsorption processes. Discussion of removal of emerging contaminants (e.g. pharmaceuticals), regulated and unregulated disinfection by-products, and current issues in potable water treatment and quality.",3,FALSE,,,,ENGR 447.,,,ENGR 447,FALSE,TRUE,FALSE,FALSE,1,https://okanagan.calendar.ubc.ca/course-descriptions/subject/engro
c-650,ENGR 444,UBCO,2023,ENGR 444 Solid Waste Engineering,Applications of engineering principles and practices to land disposal of hazardous and non-hazardous wastes.,3,FALSE,,,,"All of ENGR 340, ENGR 347.",,,"ENGR 340,ENGR 347",TRUE,FALSE,FALSE,FALSE,1,https://okanagan.calendar.ubc.ca/course-descriptions/subject/engro
c-651,ENGR 445,UBCO,2023,ENGR 445 Design of Water and Wastewater Conveyance Systems,"Identification and evaluation of design solutions for providing a community with adequate water supply, collecting and disposing of stormwater and sewage, and managing excess stormwater flow.",3,FALSE,,,,ENGR 341.,,,ENGR 341,FALSE,TRUE,FALSE,FALSE,1,https://okanagan.calendar.ubc.ca/course-descriptions/subject/engro
c-652,ENGR 447,UBCO,2023,ENGR 447 Design of Processes for Water and Wastewater Treatment,"Theory and design of fundamental physical, chemical, and biological unit operations for drinking water and municipal wastewater treatment. The design principles of coagulation, flocculation, sedimentation, filtration, biological treatment, solid handling, disinfection, and advanced treatment processes are presented.",3,FALSE,,,,ENGR 347.,,,ENGR 347,TRUE,FALSE,FALSE,FALSE,1,https://okanagan.calendar.ubc.ca/course-descriptions/subject/engro
c-653,ENGR 449,UBCO,2023,ENGR 449 Aircraft Structures,"Structural components of aircraft; design of aircraft wing and fuselage structures; bending and buckling of thin plates; moments of inertia for complex shapes; stress and deflection analysis; fatigue, safe life, damage tolerant design.",3,FALSE,,,,ENGR 476.,,,ENGR 476,FALSE,TRUE,FALSE,FALSE,1,https://okanagan.calendar.ubc.ca/course-descriptions/subject/engro
c-654,ENGR 451,UBCO,2023,ENGR 451 Microelectronics II,"Building blocks of integrated-circuit amplifiers, differential multistage amplifiers, frequency response, feedback, output stages and power amplifiers, and operational amplifier circuitry. Credit will be granted for only one of ENGR 451 or ENGR 352.",3,FALSE,,,,ENGR 351.,,,ENGR 351,TRUE,FALSE,FALSE,FALSE,1,https://okanagan.calendar.ubc.ca/course-descriptions/subject/engro
c-655,ENGR 453,UBCO,2023,ENGR 453 Internet of Things,"Sensing, actuation, sampling, analog-to-digital and digital-to-analog conversion, voice over IP, video codecs, audio codecs, multimedia communication protocols for IoT, wireless communication protocols for IoT.",3,FALSE,,,,APSC 254.,,,APSC 254,FALSE,TRUE,FALSE,FALSE,1,https://okanagan.calendar.ubc.ca/course-descriptions/subject/engro
c-656,ENGR 456,UBCO,2023,ENGR 456 Electrochemical Energy Storage Systems,"Thermodynamics and kinetics of electrochemical reactions, rechargeable batteries, Li-ion batteries, anode and cathode materials, nanostructured materials for batteries, liquid-solid and solid-solid interfaces in batteries, next-generation Naion and Li-S batteries, supercapacitors, and hybrid Li-ion supercapacitors.",3,FALSE,,,,"All of APSC 252, APSC 259.",,,"APSC 252,APSC 259",TRUE,FALSE,FALSE,FALSE,1,https://okanagan.calendar.ubc.ca/course-descriptions/subject/engro
c-657,ENGR 458,UBCO,2023,ENGR 458 Power Electronics,"Applications and roles of power electronics, power semiconductor devices, diode rectifiers, phase-controlled rectifiers, DC-DC converters, DC-AC converters, resonant converters. Examples drawn from residential and industrial applications. Credit will be granted for only one of ENGR 458 or ENGR 558.",3,FALSE,,,,ENGR 320.,,,ENGR 320,TRUE,FALSE,FALSE,FALSE,1,https://okanagan.calendar.ubc.ca/course-descriptions/subject/engro
c-658,ENGR 460,UBCO,2023,ENGR 460 Tools and Applications in Environmental and Engineering Microbiology,"Fundamentals of environmental microbiology and DNA sequencing technologies including microbial detection with molecular methods, bioinformatics and computational analysis.",3,FALSE,,,,"Either (a) all of APSC 182, APSC 183 or (b) CHEM 113 or (c) CHEM 123. (Third-year B.A.Sc. or B.Sc. Standing.)",,,"APSC 182,APSC 183,CHEM 113,CHEM 123",FALSE,TRUE,FALSE,FALSE,1,https://okanagan.calendar.ubc.ca/course-descriptions/subject/engro
c-659,ENGR 461,UBCO,2023,ENGR 461 Digital Communications,"Signal space concepts, baseband digital transmission on additive white Gaussian noise channel, optimum receiver design, transmission through bandlimited channels, coherent and non-coherent carrier modulations, elements of information theory, introduction to error control coding.",3,FALSE,,,,"All of ENGR 360, ENGR 361.",,,"ENGR 360,ENGR 361",TRUE,FALSE,FALSE,FALSE,1,https://okanagan.calendar.ubc.ca/course-descriptions/subject/engro
c-660,ENGR 466,UBCO,2023,ENGR 466 Introduction to VLSI Systems,"The chip design process using VLSI design styles in CMOS technology. Data path, control and register file design and layout. Clocking schemes, flip-flop and latch-based design. Design project using CAD tools.",3,FALSE,,,,APSC 262.,,,APSC 262,TRUE,FALSE,FALSE,FALSE,1,https://okanagan.calendar.ubc.ca/course-descriptions/subject/engro
c-661,ENGR 467,UBCO,2023,ENGR 467 Real-Time and Embedded System Design,"Multi-tasking, interrupt-driven systems, RTOSs and programming environments, task scheduling, schedulability analysis, inter-process communication and synchronization, resource management, performance measurement.",3,FALSE,,,,ENGR 359.,,,ENGR 359,FALSE,TRUE,FALSE,FALSE,1,https://okanagan.calendar.ubc.ca/course-descriptions/subject/engro
c-662,ENGR 468,UBCO,2023,ENGR 468 Advanced Digital System Design,"Design flows, system-on-chip design practices, timing, clock domains, high-speed data links, intellectual property reuse and platform-based design, application specific computing, ASIC and FPGA technologies, and hardware/software co-design. Credit will be granted for only one of ENGR 468 or ENGR 568.",3,FALSE,,,,"All of APSC 262, ENGR 359.",,,"APSC 262,ENGR 359",TRUE,FALSE,FALSE,FALSE,1,https://okanagan.calendar.ubc.ca/course-descriptions/subject/engro
c-663,ENGR 469,UBCO,2023,ENGR 469 Polymer Engineering,"Introduction to polymer science and technology, molecular structure of polymers, polymer synthesis, structure-property relationship in polymers, physical properties of polymers, reinforced polymers, polymer composites and nanocomposites, polymer characterization, polymer processing, and forming.",3,FALSE,,,,"All of APSC 259, APSC 260.",,,"APSC 259,APSC 260",FALSE,TRUE,FALSE,FALSE,1,https://okanagan.calendar.ubc.ca/course-descriptions/subject/engro
c-664,ENGR 472,UBCO,2023,ENGR 472 Fibre Optics and Photonics,"Introduction to fibre optic transmission, single-mode and multimode fibre optics, dispersion and absorption design criteria, semiconductor diode lasers, LEDs, modulators, pn and p-i-n receivers, point-to-point and network implementations of fibre optic networks and integrated photonic systems. Credit will be granted for only one of ENGR 472 or ENGR 572.",3,FALSE,,,,ENGR 365.,,,ENGR 365,FALSE,TRUE,FALSE,FALSE,1,https://okanagan.calendar.ubc.ca/course-descriptions/subject/engro
c-665,ENGR 473,UBCO,2023,ENGR 473 Antennas and Propagation,"Wave propagation models, radiation patterns, directivity and gain, radiation resistance, Friis transmission equation, reciprocity, dipole antennas, image theory, loop antennas, uniform and non-uniform antenna arrays, broadband antennas, aperture antennas. Credit will be granted for only one of ENGR 473 or ENGR 574.",3,FALSE,,,,ENGR 365.,,,ENGR 365,TRUE,FALSE,FALSE,FALSE,1,https://okanagan.calendar.ubc.ca/course-descriptions/subject/engro
c-666,ENGR 474,UBCO,2023,ENGR 474 Analog Integrated Circuits,"Design and analysis of analog integrated circuits with emphasis on CMOS technology. MOS device physics and models, processing technology and layout, differential amplifiers, current mirrors, noise, feedback, opamp design and compensation, two-stage CMOS opamp design, switched-capacitor filters.",3,FALSE,,,,ENGR 451.,,,ENGR 451,FALSE,TRUE,FALSE,FALSE,1,https://okanagan.calendar.ubc.ca/course-descriptions/subject/engro
c-667,ENGR 475,UBCO,2023,ENGR 475 Materials Selection and Design,"Review of materials classifications, ASTM standard for ferrous materials and non-ferrous alloys. Material property charts. Materials selection and material indices. Introduction to various materials processing. Process selection and materials selection with multiple constraints and objectives, cost analysis.",3,FALSE,,,,ENGR 376.,,,ENGR 376,FALSE,TRUE,FALSE,FALSE,1,https://okanagan.calendar.ubc.ca/course-descriptions/subject/engro
c-668,ENGR 476,UBCO,2023,ENGR 476 Mechanics of Materials II,"Bending of curved beams; bending of beams with asymmetric cross-sections; shear flow and centre; review of beam deflections; column buckling; Castigliano's theorem; statically indeterminate beams, frames, and rings; Torsion of noncircular members.",3,FALSE,,,,APSC 260.,,,APSC 260,TRUE,FALSE,FALSE,FALSE,1,https://okanagan.calendar.ubc.ca/course-descriptions/subject/engro
c-669,ENGR 477,UBCO,2023,ENGR 477 Aircraft Propulsion,"Propulsion requirements, effects of Mach number, altitude, and application; basic propeller theory; propeller, turboshaft, turbojet, turbofan; cycle analysis and optimization for gas turbine power plant; inter-relations between thermodynamic, aerodynamic and mechanical designs; selection of aeroengines; principles of rocket propulsion systems.",3,FALSE,This course is restricted to students in one of these programs: BASC-O in year: >=4 with one of these specializations: ****MECH,,,ENGR 310.,,,ENGR 310,TRUE,FALSE,FALSE,FALSE,1,https://okanagan.calendar.ubc.ca/course-descriptions/subject/engro
c-670,ENGR 478,UBCO,2023,ENGR 478 Alternative Energy Systems,"Description of alternative sources of energy, electric vehicles, thermosolar energy, generation of electricity by photovoltaic effect, wind power energy, hydropower, geothermal, nuclear power, power plants with fuel cells, aspects of hydrogen as fuels, fuel from biomass, energy storage parameters, integration of alternative sources of energy.",3,FALSE,,,,"All of ENGR 375, ENGR 385.",,,"ENGR 375,ENGR 385",FALSE,TRUE,FALSE,FALSE,1,https://okanagan.calendar.ubc.ca/course-descriptions/subject/engro
c-671,ENGR 479,UBCO,2023,ENGR 479 Measurement Principles in Thermal-Fluids,Instruments and methods of measuring fluid thermo-physical properties. Pressure-based velocity measurements. Thermal anemometry. Particle-based techniques for velocity measurement. Sonic anemometry/thermometry. Measurement of flow pressure and density. Measurement techniques for temperature and heat flux. Fundamentals of data processing and analysis.,3,FALSE,,,,"All of ENGR 310, ENGR 385.",,,"ENGR 310,ENGR 385",FALSE,TRUE,FALSE,FALSE,1,https://okanagan.calendar.ubc.ca/course-descriptions/subject/engro
c-672,ENGR 480,UBCO,2023,ENGR 480 Modern Control,"State-space modelling and design. Review of linear and matrix algebra, highlights of classical control theory, state-space modelling, continuous and discrete state equations, stability, controllability and observability, design of feedback systems. Credit will be granted for only one of ENGR 480 or ENGR 580.",3,FALSE,,,,ENGR 315.,,,ENGR 315,TRUE,FALSE,FALSE,FALSE,1,https://okanagan.calendar.ubc.ca/course-descriptions/subject/engro
c-673,ENGR 482,UBCO,2023,ENGR 482 Biomedical Engineering I,"Introduction to the microcirculation; gas exchange in organs, including diffusion, perfusion and ventilation; surface energy in biological systems; principles of hemodynamics including vascular resistance and flow regimes at different levels of organs, tissues and cells; principles of tissue mechanics; introduction to tissue engineering; introduction to medical devices design and development.",3,FALSE,,,,(Fourth-year standing.),,,,TRUE,FALSE,FALSE,FALSE,1,https://okanagan.calendar.ubc.ca/course-descriptions/subject/engro
c-674,ENGR 484,UBCO,2023,ENGR 484 Heat and Mass Transfer,"Heat exchanger design, heat transfer with phase change, radiation heat transfer, steady and transient mass diffusion, convective mass transfer, simultaneous heat and mass transfer. Credit will be granted for only one of ENGR 484 or ENGR 584.",3,FALSE,,,,"All of ENGR 310, ENGR 385.",,,"ENGR 310,ENGR 385",TRUE,FALSE,FALSE,FALSE,1,https://okanagan.calendar.ubc.ca/course-descriptions/subject/engro
